id;bill_number;bill_date;paid_amount;mode_of_payment;mode_of_description;payid;created_by;created_date;last_modified_by;last_modified_date;transaction_id
1;mobile Fish;2019-06-15;59865;Table Computer;Trace;Savings Account alarm;Tasty Metal Bacon;2019-06-15;Electronics;2019-06-15;2
2;methodology Albania;2019-06-15;2306;Namibia;Steel zero administration;Multi-channelled Licensed;grey Cambridgeshire;2019-06-15;Refined Rubber Chicken Table;2019-06-16;1
3;Usability South Dakota envisioneer;2019-06-16;9767;Nakfa;Bahamian Dollar Investment Account;Games Regional Digitized;copy convergence;2019-06-16;Georgia Industrial;2019-06-15;8
4;Markets Chief;2019-06-15;72727;archive Georgia Aruba;software scale interactive;Louisiana Specialist Home Loan Account;Plastic;2019-06-15;Small;2019-06-15;5
5;reinvent 24 hour Jewelery;2019-06-16;70685;application quantify Unbranded Plastic Tuna;Internal;Investment Account archive Fantastic Plastic Chicken;payment;2019-06-15;tangible Mississippi;2019-06-15;2
6;bus synthesize Idaho;2019-06-15;25606;Sleek Metal Table Small;Intelligent Outdoors;Harbor Montana;Corporate Phased relationships;2019-06-15;User-centric;2019-06-16;6
7;Chilean Peso Unidades de fomento;2019-06-15;92969;virtual deposit;Squares mint green e-business;Ghana back-end National;Direct;2019-06-16;withdrawal;2019-06-16;9
8;SQL Games;2019-06-15;53408;Bedfordshire Bahamian Dollar;24/7;Gloves sky blue Oklahoma;robust Engineer;2019-06-15;Quality-focused;2019-06-15;8
9;Plastic;2019-06-15;3688;Personal Loan Account;paradigms Home;Investor Public-key;Lebanon;2019-06-15;Dominican Republic Credit Card Account Handmade;2019-06-15;3
10;transmitter;2019-06-15;47030;Orchestrator deliver;Licensed hacking installation;Argentine Peso;Kentucky Algerian Dinar Clothing;2019-06-15;Future-proofed deposit Sausages;2019-06-15;4
